{
  "schema": "com.nordstrom/retail-stream-ingress/1-0-0",
  "origin": "scripts/put-retail-stream-event",
  "timeOrigin": "2017-02-21T23:27:56.673Z",
  "data": {
    "schema": "com.nordstrom/product/create/1-0-0",
    "id": "9000000",
    "brand": "Scripted Brand",
    "name": "Scripted Name",
    "description": "This product came from the put-retail-stream-event script.",
    "category": "Test Script Category"
  }
}
